show_id,type,title,director,cast,country,date_added,release_year,rating,duration,listed_in,description
s381,TV Show,The Flash,Glen Winter,"Grant Gustin, Candice Patton, Danielle Panabaker, Carlos Valdes, Tom Cavanagh, Jesse L. Martin, Neil Sandilands, Britne Oldford, Danielle Nicolet, Keiynan Lonsdale, Kim Engelbrecht",United States,"July 28, 2021",2021,TV-14,7 Seasons,"Crime TV Shows, TV Action & Adventure, TV Sci-Fi & Fantasy",A forensics expert who wakes from a coma with amazing new powers squares off against forces threatening the city in this live-action superhero romp.
s384,Movie,Department,Ram Gopal Varma,"Amitabh Bachchan, Sanjay Dutt, Rana Daggubati, Vijay Raaz, Abhimanyu Singh, Madhu Shalini, Deepak Tijori, Anjana Sukhani, Manchu Lakshmi",India,"July 27, 2021",2012,TV-MA,143 min,"Action & Adventure, International Movies","Two cops form a task force to take down two mobsters, but when a sinister politician enters the picture, dubious loyalties and motives come to light."
s390,Movie,The Operative,Yuval Adler,"Diane Kruger, Martin Freeman, Cas Anvar, Rotem Keinan, Yohanan Herson","France, Israel, Germany, United States, United Kingdom","July 27, 2021",2019,TV-MA,117 min,"Dramas, International Movies, Thrillers","Working as a Mossad spy assigned to Tehran, Rachel reaches her breaking point. Now it’s dangerously hard to tell whose side she’s on."
s393,Movie,Django Unchained,Quentin Tarantino,"Jamie Foxx, Christoph Waltz, Leonardo DiCaprio, Kerry Washington, Samuel L. Jackson, Walton Goggins, Dennis Christopher, James Remar, David Steen, Dana Gourrier, Nichole Galicia, Laura Cayouette, Ato Essandoh, Sammi Rotibi, Escalante Lundy, Don Johnson",United States,"July 24, 2021",2012,R,165 min,"Action & Adventure, Dramas","Accompanied by a German bounty hunter, a freed slave named Django travels across America to free his wife from a sadistic plantation owner."
s394,Movie,A Second Chance:  Rivals!,Clay Glen,"Emily Morris, Stella Shute, Eva Grados, India Colombi, Nina Pearce, Adam Tuominen, Carmel Johnson, Natasha Wanganeen, Elysia Markou, Alexander Lloyd, Amy Handley",Australia,"July 23, 2021",2021,PG,91 min,"Children & Family Movies, Sports Movies","Crushed when she doesn't qualify for the Olympics, a now-grown Maddy Cornell finds new purpose coaching young gymnasts going up against a rival team."
s403,Movie,The Last Letter From Your Lover,Augustine Frizzell,"Shailene Woodley, Felicity Jones, Callum Turner, Joe Alwyn, Nabhaan Rizwan, Ncuti Gatwa, Emma Appleton, Christian Brassington, Alice Orr-Ewing, Lee Knight, Zoe Boyle, Ben Cross, Diana Kent",United Kingdom,"July 23, 2021",2021,TV-MA,111 min,"Dramas, Romantic Movies","After finding a trove of love letters from 1965, a reporter sets out to solve the mystery of a secret affair — while embarking on a romance of her own."
s411,Movie,Chhota Bheem And The Broken Amulet,Rajiv Chilaka,"Vatsal Dubey, Julie Tejwani, Rupa Bhimani, Jigna Bhardwaj, Rajesh Kava, Mousam, Swapnil",India,"July 22, 2021",2013,TV-Y7,64 min,Children & Family Movies,"When a stranger tries to steal an amulet from the palace, Bheem learns the sad story behind the ornament and heads to Africa to defeat the real villain."
s416,Movie,Chhota Bheem aur Krishna,Rajiv Chilaka,"Vatsal Dubey, Julie Tejwani, Rupa Bhimani, Jigna Bhardwaj, Rajesh Kava, Arun Shekher, Sanchit Wartak",India,"July 22, 2021",2009,TV-Y7,68 min,Children & Family Movies,"Centuries after the end of a conqueror's rule, he is mysteriously back from the dead. It’s up to Bheem to save Dholakpur from being taken over!"
s427,Movie,Cousins,"Ainsley Gardiner, Briar Grace-Smith","Rachel House, Briar Grace-Smith, Tanea Heke, Tioreore Ngatai-Melbourne, Ana Scotney, Hariata Moriarty, Chelsie Preston Crayford, Sylvia Rands",New Zealand,"July 22, 2021",2021,TV-MA,99 min,Dramas,"Separated as children, three cousins with an unshakeable bond confront their painful pasts and embark on an emotional journey to find each other."
s430,Movie,Sanitation Day,Seyi Babatope,"Blossom Chukwujekwu, Elozonam Ogbolu, Nse Ikpe-Etim, Belinda Effah, Saeed Mohammed, Chukwuemeka Okoroafor, Kunle Fawole, Chris Okagbue, Adebayo Salami, Charles Inojie, Elvina Ibru, Tobi Bakare",Nigeria,"July 21, 2021",2020,TV-14,105 min,"Dramas, International Movies, Thrillers",Two cops must contend with the uncooperative tenants of an apartment complex as they try to solve a murder before the crime scene is wiped clean.
s434,Movie,Milkwater,Morgan Ingari,"Molly Bernard, Patrick Breen, Robin de Jesús, Ava Eisenson, Ade Otukoya",United States,"July 20, 2021",2020,TV-MA,102 min,"Comedies, Dramas, Independent Movies",Aimless 20-something Milo impulsively becomes a gay man’s surrogate and wrestles with the emotional complexities of her non-traditional decision.
s437,Movie,The Tambour of Retribution,Abdulaziz Alshlahei,"Faisal Al Dokhei, Adwa Fahad, Muhand Alsaleh, Rawya Ahmed, Ajeba Aldosary, Aly Ibrahim, Samer Elkhal, Hashem Hawsawi, Ibrahim Mesisebi, Shabib Alkhaleefa, Abdulateif Saud, Nada Alshehry, Dhay Nasser",Saudi Arabia,"July 19, 2021",2021,TV-14,91 min,"Dramas, International Movies, Romantic Movies","In an impoverished neighborhood, the son of a swordsman falls in love with the daughter of a wedding singer — a taboo match in a traditional society."
s438,Movie,Cosmic Sin,Edward Drake,"Frank Grillo, Bruce Willis, Brandon Thomas Lee, Corey Large, Perrey Reeves, C.J. Perry, Lochlyn Munro, Costas Mandylor, Adelaide Kane, Eva De Dominici, Sarah May Sommers, Trevor Gretzky",United States,"July 17, 2021",2021,R,88 min,Action & Adventure,"In the year 2524, a disgraced retired general is called back into combat to help prevent an interstellar war against a hostile alien fleet."
s440,Movie,Deep,"Sita Likitvanichkul, Jetarin Ratanaserikiat, Apirak Samudkitpaisan, Thanabodee Uawithya, Adirek Wattaleela","Panisara Rikulsurakan, Kay Lertsittichai, Supanaree Sutavijitvong, Krit Jeerapattananuwong, Warisara Jitpreedasakul, Dujdao Vadhanapakorn, Kim Waddoup, Philaiwan Khamphirathat, Wongsakorn Rassamitat, Bhumibhat Thavornsiri",Thailand,"July 16, 2021",2021,TV-MA,101 min,"Dramas, International Movies, Thrillers",Four insomniac med school students are lured into a neuroscience experiment that spirals out of control — and must find a way out before it’s too late.
s446,Movie,The Beguiled,Sofia Coppola,"Colin Farrell, Nicole Kidman, Kirsten Dunst, Elle Fanning, Oona Laurence, Angourie Rice, Addison Riecke, Emma Howard",United States,"July 16, 2021",2017,R,94 min,"Dramas, Independent Movies, Thrillers","During the Civil War, a wounded Union soldier takes refuge at a Southern girls school, rupturing the calm amid growing sexual tension and infighting."
s447,Movie,The Book of Henry,Colin Trevorrow,"Naomi Watts, Jaeden Martell, Jacob Tremblay, Sarah Silverman, Dean Norris, Lee Pace, Maddie Ziegler, Tonya Pinkins, Bobby Moynihan, Geraldine Hughes",United States,"July 16, 2021",2017,PG-13,105 min,Dramas,"An 11-year-old vows to help a new neighbor who he suspects is in danger, and documents his efforts in a series of written entries and audio recordings."
s448,Movie,The Twilight Saga: Breaking Dawn: Part 1,Bill Condon,"Kristen Stewart, Robert Pattinson, Taylor Lautner, Billy Burke, Peter Facinelli, Elizabeth Reaser, Kellan Lutz, Nikki Reed, Jackson Rathbone, Ashley Greene",United States,"July 16, 2021",2011,PG-13,117 min,"Dramas, Romantic Movies","After a dream wedding, Bella and Edward enter a new nightmare when a shocking development forces life-or-death decisions."
s449,Movie,The Twilight Saga: Breaking Dawn: Part 2,Bill Condon,"Kristen Stewart, Robert Pattinson, Taylor Lautner, Peter Facinelli, Elizabeth Reaser, Ashley Greene, Jackson Rathbone, Kellan Lutz, Nikki Reed, Billy Burke",United States,"July 16, 2021",2012,PG-13,115 min,"Dramas, Romantic Movies","In the epic series' final chapter, Bella and Edward's newborn daughter forces the couple into a life-altering confrontation with the Volturi."
s450,Movie,The Twilight Saga: Eclipse,David Slade,"Kristen Stewart, Robert Pattinson, Taylor Lautner, Bryce Dallas Howard, Billy Burke, Dakota Fanning, Peter Facinelli, Elizabeth Reaser, Jackson Rathbone, Kellan Lutz, Ashley Greene, Nikki Reed",United States,"July 16, 2021",2010,PG-13,124 min,"Dramas, Romantic Movies","With a bloodthirsty enemy on a quest for revenge, Bella must reconcile her love for vampire Edward and her growing feelings for werewolf Jacob."
s451,Movie,The Twilight Saga: New Moon,Chris Weitz,"Kristen Stewart, Robert Pattinson, Taylor Lautner, Ashley Greene, Rachelle Lefevre, Billy Burke, Michael Sheen, Dakota Fanning, Peter Facinelli, Elizabeth Reaser, Jackson Rathbone, Kellan Lutz, Nikki Reed, Edi Gathegi",United States,"July 16, 2021",2009,PG-13,131 min,"Dramas, Romantic Movies","Still reeling from the departure of vampire Edward Cullen, a heartbroken Bella Swan finds comfort in her friendship with werewolf Jacob Black."
s452,Movie,Twilight,Catherine Hardwicke,"Kristen Stewart, Robert Pattinson, Billy Burke, Peter Facinelli, Elizabeth Reaser, Cam Gigandet, Ashley Greene, Anna Kendrick, Nikki Reed, Taylor Lautner, Jackson Rathbone, Kellan Lutz",United States,"July 16, 2021",2008,PG-13,122 min,"Action & Adventure, Dramas, Romantic Movies","When Bella Swan moves in with her father, she starts school and meets Edward, a mysterious classmate who reveals himself to be a 108-year-old vampire."
s453,Movie,A Perfect Fit,Hadrah Daeng Ratu,"Nadya Arina, Refal Hady, Giorgino Abraham, Anggika Bolsterli, Laura Theux, Christine Hakim, Unique Priscilla, Karina Suwandi, Mathias Muchus, Ayu Laksmi, I Made Sidia, Dominique Sanda, Bryan Domani, Wafda Saifan, Yayu Unru, Dave Hendrik",Indonesia,"July 15, 2021",2021,TV-PG,113 min,"Comedies, Dramas, International Movies","Sparks fly when a fashion blogger in Bali meets a gifted shoemaker, leading her to question her commitment to her fiancé."
s461,Movie,Surf's Up,"Ash Brannon, Chris Buck","Shia LaBeouf, Jeff Bridges, Zooey Deschanel, Jon Heder, James Woods, Diedrich Bader, Mario Cantone, Kelly Slater, Rob Machado, Sal Masekela","United States, Canada","July 15, 2021",2007,PG,86 min,"Children & Family Movies, Comedies, Sports Movies",This Oscar-nominated animated comedy goes behind the scenes at the Penguin World Surfing Championship to get a close-up look at the inventors of surfing.
s464,Movie,A Classic Horror Story,"Roberto De Feo, Paolo Strippoli","Matilda Lutz, Francesco Russo, Peppino Mazzotta, Will Merrick, Yuliia Sobol, Alida Baldari Calabria, Cristina Donadio, Francesca Cavallin",Italy,"July 14, 2021",2021,TV-MA,95 min,"Horror Movies, International Movies","In this gruesome suspense film, strangers traveling in southern Italy become stranded in the woods, where they must fight desperately to get out alive."
s470,Movie,American Woman,Semi Chellas,"Hong Chau, Sarah Gadon, John Gallagher Jr., Lola Kirke, Ellen Burstyn, David Cubitt, Jordan Pettle, Richard Walters","United States, Canada","July 13, 2021",2019,TV-MA,87 min,"Dramas, Independent Movies","In rural Pennsylvania, a working-class single mom must pick up the pieces and step up to raise her grandson after her daughter suddenly disappears."
s475,Movie,American Ultra,Nima Nourizadeh,"Jesse Eisenberg, Kristen Stewart, Topher Grace, Connie Britton, Walton Goggins, John Leguizamo, Bill Pullman, Tony Hale, Lavell Crawford, Stuart Greer","United States, Switzerland","July 10, 2021",2015,R,96 min,"Action & Adventure, Comedies","He's just a weed fiend going nowhere, or so he thinks. When the CIA tries to eliminate him, his long-dormant superspy training comes roaring back."
s487,Movie,Ratchet and Clank,"Jericca Cleland, Kevin Munroe","Paul Giamatti, John Goodman, Bella Thorne, Rosario Dawson, Jim Ward, Armin Shimerman, Vincent Tong, Andrew Cownden, James Arnold Taylor, David Kaye, Sylvester Stallone","Hong Kong, Canada, United States","July 9, 2021",2016,PG,94 min,"Children & Family Movies, Comedies, Sci-Fi & Fantasy",Affable alien Ratchet longs to be a Galactic Ranger and might get the chance when rogue robot Clank tells him of evil Drek's plot to destroy a galaxy.
s490,Movie,Back to Q82,Ahmed Siddiqui,"Jassim Al Nabhan, Abdel Imam Abdullah, Abdulaziz El Nassar, Khalid Muthafar, Amal Anbari, Ali Al-Hamdaan, El Hussein Abd, Nawaf Al Shemmeri, Bashar Abd Alah, Naser Albouloshy","Kuwait, United States","July 8, 2021",2017,TV-14,104 min,"Comedies, International Movies","Eager to rejoin her divorced parents, an inventor's daughter drives his time-traveling car back to 1982. But a secret crush accidentally follows."
s492,Movie,Home Again,Hallie Meyers-Shyer,"Reese Witherspoon, Michael Sheen, Candice Bergen, Nat Wolff, Jon Rudnitsky, Pico Alexander, Lake Bell, Reid Scott, Dolly Wells, Lola Flanery, Eden Grace Redfield, P.J. Byrne",United States,"July 8, 2021",2017,PG-13,97 min,"Comedies, Dramas, Romantic Movies","A newly single mom takes in three young male filmmakers as boarders, but her estranged husband returns to complicate her new, unconventional life."
s493,Movie,Midnight Sun,Scott Speer,"Bella Thorne, Patrick Schwarzenegger, Rob Riggle, Quinn Shephard, Suleka Mathew, Tiera Skovbye, Ken Tremblett, Norm Misura, Austin Obiajunwa, Nicholas Coombe",United States,"July 8, 2021",2018,PG-13,91 min,"Dramas, Romantic Movies","Born with a fatal sensitivity to sunlight, a sheltered teen girl falls for her neighbor, but hides her condition from him as their romance blossoms."
s495,Movie,Rock the Kasbah,Barry Levinson,"Bill Murray, Kate Hudson, Zooey Deschanel, Danny McBride, Scott Caan, Leem Lubany, Bruce Willis, Arian Moayed, Taylor Kinney, Glenn Fleshler",United States,"July 8, 2021",2015,R,106 min,"Comedies, Music & Musicals","When a has-been music producer gets stuck in Afghanistan he discovers a girl with a wonderful voice, then has to find a way to market her talents."
s497,Movie,Brick Mansions,Camille Delamarre,"Paul Walker, David Belle, RZA, Gouchy Boy, Catalina Denis, Ayisha Issa, Carlo Rota, Andreas Apergis, Richard Zeman, Robert Maillet","France, Canada, United States, Spain","July 7, 2021",2014,PG-13,90 min,"Action & Adventure, International Movies",An undercover police detective partners with an ex-convict to take down a drug kingpin amid grime and crime in a walled-off Detroit housing project.
